{
  "schemaVersion": "0.2",
  "layoutId": "47key",
  "name": "Malti (47-key, MSA 100-2002)",
  "version": "1.0.0",
  "license": "NOASSERTION",
  "authors": [
    "Steven R. Loomis"
  ],
  "description": "Imported from an LDML Keyboard 3 file (mt47.xml, conformsTo 47). Draft 0.2 core.",
  "locales": [
    "mt",
    "en"
  ],
  "geometry": [
    "ansi-full"
  ],
  "keys": [
    {
      "id": "E00",
      "hid": "0x35",
      "levels": {
        "1": "ċ",
        "2": "Ċ",
        "3": "`",
        "4": "~"
      }
    },
    {
      "id": "E01",
      "hid": "0x1E",
      "levels": {
        "1": "1",
        "2": "!"
      }
    },
    {
      "id": "E02",
      "hid": "0x1F",
      "levels": {
        "1": "2",
        "2": "@"
      }
    },
    {
      "id": "E03",
      "hid": "0x20",
      "levels": {
        "1": "3",
        "2": "€",
        "3": "£"
      }
    },
    {
      "id": "E04",
      "hid": "0x21",
      "levels": {
        "1": "4",
        "2": "$"
      }
    },
    {
      "id": "E05",
      "hid": "0x22",
      "levels": {
        "1": "5",
        "2": "%"
      }
    },
    {
      "id": "E06",
      "hid": "0x23",
      "levels": {
        "1": "6",
        "2": "^"
      }
    },
    {
      "id": "E07",
      "hid": "0x24",
      "levels": {
        "1": "7",
        "2": "&"
      }
    },
    {
      "id": "E08",
      "hid": "0x25",
      "levels": {
        "1": "8",
        "2": "*"
      }
    },
    {
      "id": "E09",
      "hid": "0x26",
      "levels": {
        "1": "9",
        "2": "("
      }
    },
    {
      "id": "E10",
      "hid": "0x27",
      "levels": {
        "1": "0",
        "2": ")"
      }
    },
    {
      "id": "E11",
      "hid": "0x2D",
      "levels": {
        "1": "-",
        "2": "_"
      }
    },
    {
      "id": "E12",
      "hid": "0x2E",
      "levels": {
        "1": "=",
        "2": "+"
      }
    },
    {
      "id": "D01",
      "hid": "0x14",
      "levels": {
        "1": "q",
        "2": "Q"
      }
    },
    {
      "id": "D02",
      "hid": "0x1A",
      "levels": {
        "1": "w",
        "2": "W"
      }
    },
    {
      "id": "D03",
      "hid": "0x08",
      "levels": {
        "1": "e",
        "2": "E",
        "3": "è",
        "4": "È"
      }
    },
    {
      "id": "D04",
      "hid": "0x15",
      "levels": {
        "1": "r",
        "2": "R"
      }
    },
    {
      "id": "D05",
      "hid": "0x17",
      "levels": {
        "1": "t",
        "2": "T"
      }
    },
    {
      "id": "D06",
      "hid": "0x1C",
      "levels": {
        "1": "y",
        "2": "Y"
      }
    },
    {
      "id": "D07",
      "hid": "0x18",
      "levels": {
        "1": "u",
        "2": "U",
        "3": "ù",
        "4": "Ù"
      }
    },
    {
      "id": "D08",
      "hid": "0x0C",
      "levels": {
        "1": "i",
        "2": "I",
        "3": "ì",
        "4": "Ì"
      }
    },
    {
      "id": "D09",
      "hid": "0x12",
      "levels": {
        "1": "o",
        "2": "O",
        "3": "ò",
        "4": "Ò"
      }
    },
    {
      "id": "D10",
      "hid": "0x13",
      "levels": {
        "1": "p",
        "2": "P"
      }
    },
    {
      "id": "D11",
      "hid": "0x2F",
      "levels": {
        "1": "ġ",
        "2": "Ġ",
        "3": "[",
        "4": "{"
      }
    },
    {
      "id": "D12",
      "hid": "0x30",
      "levels": {
        "1": "ħ",
        "2": "Ħ",
        "3": "]",
        "4": "}"
      }
    },
    {
      "id": "D13",
      "hid": "0x31",
      "levels": {
        "1": "ż",
        "2": "Ż",
        "3": "\\",
        "4": "|"
      }
    },
    {
      "id": "C01",
      "hid": "0x04",
      "levels": {
        "1": "a",
        "2": "A",
        "3": "à",
        "4": "À"
      }
    },
    {
      "id": "C02",
      "hid": "0x16",
      "levels": {
        "1": "s",
        "2": "S"
      }
    },
    {
      "id": "C03",
      "hid": "0x07",
      "levels": {
        "1": "d",
        "2": "D"
      }
    },
    {
      "id": "C04",
      "hid": "0x09",
      "levels": {
        "1": "f",
        "2": "F"
      }
    },
    {
      "id": "C05",
      "hid": "0x0A",
      "levels": {
        "1": "g",
        "2": "G"
      }
    },
    {
      "id": "C06",
      "hid": "0x0B",
      "levels": {
        "1": "h",
        "2": "H"
      }
    },
    {
      "id": "C07",
      "hid": "0x0D",
      "levels": {
        "1": "j",
        "2": "J"
      }
    },
    {
      "id": "C08",
      "hid": "0x0E",
      "levels": {
        "1": "k",
        "2": "K"
      }
    },
    {
      "id": "C09",
      "hid": "0x0F",
      "levels": {
        "1": "l",
        "2": "L"
      }
    },
    {
      "id": "C10",
      "hid": "0x33",
      "levels": {
        "1": ";",
        "2": ":"
      }
    },
    {
      "id": "C11",
      "hid": "0x34",
      "levels": {
        "1": "'",
        "2": "\""
      }
    },
    {
      "id": "B01",
      "hid": "0x1D",
      "levels": {
        "1": "z",
        "2": "Z"
      }
    },
    {
      "id": "B02",
      "hid": "0x1B",
      "levels": {
        "1": "x",
        "2": "X"
      }
    },
    {
      "id": "B03",
      "hid": "0x06",
      "levels": {
        "1": "c",
        "2": "C"
      }
    },
    {
      "id": "B04",
      "hid": "0x19",
      "levels": {
        "1": "v",
        "2": "V"
      }
    },
    {
      "id": "B05",
      "hid": "0x05",
      "levels": {
        "1": "b",
        "2": "B"
      }
    },
    {
      "id": "B06",
      "hid": "0x11",
      "levels": {
        "1": "n",
        "2": "N"
      }
    },
    {
      "id": "B07",
      "hid": "0x10",
      "levels": {
        "1": "m",
        "2": "M"
      }
    },
    {
      "id": "B08",
      "hid": "0x36",
      "levels": {
        "1": ",",
        "2": "<"
      }
    },
    {
      "id": "B09",
      "hid": "0x37",
      "levels": {
        "1": ".",
        "2": ">"
      }
    },
    {
      "id": "B10",
      "hid": "0x38",
      "levels": {
        "1": "/",
        "2": "?"
      }
    },
    {
      "id": "A03",
      "hid": "0x2C",
      "levels": {
        "1": " ",
        "2": " ",
        "3": " ",
        "4": " "
      }
    }
  ],
  "exports": [
    {
      "target": "ldml-keyboard-3",
      "id": "ldml",
      "options": {
        "conformsTo": 47
      }
    }
  ],
  "extensionsUsed": [
    "OKLM_ldml"
  ],
  "extensions": {
    "OKLM_ldml": {
      "source": {
        "namespace": "https://schemas.unicode.org/cldr/47/keyboard3",
        "locale": "mt-t-k0-47key"
      },
      "info": {
        "layout": "QWERTY",
        "indicator": "MT",
        "attribution": "Malta Standards Authority"
      }
    }
  }
}
